{
  "name": "VigoTech Alliance",
  "logo": "https://github.com/VigoTech/Design-elements/blob/master/01%20IDENTIDAD%20CORPORATIVA/01%20EXPORT/PNG/Logo%20VIGOTECH_claim-es-horizontal-fondo-blanco.png?raw=true",
  "sticker": "http://hexb.in/hexagons/vigotech.png",
  "links": {
    "web": "http://vigotech.org/",
    "twitter": "http://twitter.com/vigotechallianc",
    "mail": "alliance@vigotech.org",
    "github": "https://github.com/VigoTech"
  },
  "members": {
    "agilevigo": {
      "name": "Agile Vigo",
      "logo": "http://vigotech.org/images/agile_vigo.jpg",
      "links": {
        "web": "https://www.agilevigo.com/",
        "twitter": "https://twitter.com/agilevigo",
        "meetup": "https://www.meetup.com/es-ES/agile-vigo/",
        "github": "https://github.com/agileVigo"
      }
    },
    "aindustriosa": {
      "name": "Agile Vigo",
      "logo": "http://vigotech.org/images/aindustriosa.png",
      "links": {
        "web": "https://aindustriosa.org/",
        "twitter": "https://twitter.com/aindustriosa",
        "meetup": "https://www.meetup.com/es-ES/AIndustriosa/",
        "youtube": "https://www.youtube.com/channel/UC9DPKfcLiNd7SEU-QLlIG7A"
      }
    },
    "blockchaingal": {
      "name": "Blockchain.gal Vigo",
      "logo": "http://vigotech.org/images/blockchaingal.png",
      "links": {
        "web": "https://blockchain.gal",
        "twitter": "https://twitter.com/blockchain_gal",
        "meetup": "https://www.meetup.com/es-ES/blockchain_gal_vigo",
        "github": "https://github.com/blockchain-gal"
      }
    },
    "codesign": {
      "name": "CodeSign Project",
      "logo": "http://vigotech.org/images/codesign.png",
      "links": {
        "facebook": "https://www.facebook.com/codesignproj/",
        "twitter": "https://twitter.com/codesign_pro/",
        "meetup": "https://www.meetup.com/es-ES/codesign-project/",
        "linkedin": "https://www.linkedin.com/company-beta/11049865/"
      }
    },
    "galpon": {
      "name": "GALPon",
      "logo": "http://vigotech.org/images/galpon.png",
      "links": {
        "web": "https://www.galpon.org",
        "twitter": "https://twitter.com/galpon",
        "maillist": "https://www.galpon.org/content/listas-correo-galpon"
      }
    },
    "galstech": {
      "name": "GalsTech",
      "logo": "http://vigotech.org/images/galstech.png",
      "links": {
        "meetup": "https://www.meetup.com/GalsTech/",
        "twitter": "https://twitter.com/galstech_?lang=es"
      }
    },
    "gdgvigo": {
      "name": "GDG Vigo",
      "logo": "http://vigotech.org/images/gdg_vigo.png",
      "links": {
        "twitter": "http://twitter.com/GDGVigo/",
        "meetup": "https://www.meetup.com/es-ES/GDGVigo/?chapter_analytics_code=UA-73757047-1",
        "youtube": "https://www.youtube.com/user/GDGVigo"
      }
    },
    "joomlavigo": {
      "name": "Grupo de Usuarios de Joomla de Vigo",
      "logo": "http://vigotech.org/images/joomla_vigo.png",
      "links": {
        "web": "https://www.joomlavigo.es/",
        "twitter": "https://twitter.com/JoomlaVigo",
        "facebook": "https://www.facebook.com/JoomlaVigo/",
        "meetup": "https://www.meetup.com/es-ES/Grupo-de-Usuarios-de-Joomla-de-Vigo/"
      }
    },
    "jsvigo": {
      "name": "JavascriptVigo",
      "logo": "http://vigotech.org/images/jsvigo.png",
      "links": {
        "meetup": "https://www.meetup.com/es-ES/JavaScriptVigo/",
        "twitter": "http://twitter.com/JavaScriptVigo/",
        "youtube": "https://www.youtube.com/channel/UCjFplxtEs0XtunTn-n0LUtQ"
      }
    },
    "phpvigo": {
      "name": "PHPVigo",
      "logo": "http://vigotech.org/images/php_vigo.jpg",
      "links": {
        "web": "http://phpvigo.com/",
        "meetup": "https://www.meetup.com/es-ES/PHPVigo/",
        "twitter": "https://twitter.com/phpvigo",
        "github": "https://github.com/phpvigo",
        "youtube": "https://www.youtube.com/c/phpvigo"
      }
    },
    "pythonvigo": {
      "name": "PythonVigo",
      "logo": "http://vigotech.org/images/python_vigo.png",
      "links": {
        "web": "https://www.python-vigo.es/",
        "twitter": "https://twitter.com/python_vigo?lang=es",
        "maillist": "https://lists.es.python.org/listinfo/vigo",
        "youtube": "https://www.youtube.com/channel/UCTUXabChakosnupWEnz4xTA"
      }
    },
    "seogalicia": {
      "name": "Seo Galicia",
      "logo": "http://vigotech.org/images/seogalicia.png",
      "links": {
        "facebook": "https://www.facebook.com/SEOGaliciaMeetup",
        "meetup": "https://www.meetup.com/es/SEO-Galicia/",
        "twitter": "https://twitter.com/seo_galicia"
      }
    },
    "sysadmingalicia": {
      "name": "SysAdmin Galicia",
      "logo": "http://vigotech.org/images/sysadmin_galicia.jpg",
      "links": {
        "meetup": "https://www.meetup.com/es-ES/Sysadmin-Galicia/",
        "twitter": "https://twitter.com/sysadmingalicia/"
      }
    },
    "uxgalicia": {
      "name": "UX Galicia",
      "logo": "http://vigotech.org/images/ux_gal.jpg",
      "links": {
        "web": "http://www.uxgalicia.com/",
        "meetup": "https://www.meetup.com/es-ES/Experiencia-de-Usuario-Meetup/",
        "twitter": "https://twitter.com/uxgalicia/"
      }
    },
    "vigoadg": {
      "name": "Vigo Android Developer Group",
      "logo": "http://vigotech.org/images/vigoadg.png",
      "links": {
        "twitter": "https://twitter.com/VigoADG",
        "meetup": "https://www.meetup.com/Vigo-Android-Developer-Group/"
      }
    },
    "vigobrain": {
      "name": "Vigo Brain",
      "logo": "http://vigotech.org/images/vigobrain.png",
      "links": {
        "github": "https://github.com/vigobrain/",
        "meetup": "https://www.meetup.com/es-ES/VigoBrain/",
        "twitter": "https://twitter.com/vigobrain/"
      }
    },
    "vigojug": {
      "name": "VigoJUG",
      "logo": "http://vigotech.org/images/vigojug.jpg",
      "links": {
        "web": "http://www.vigojug.org/",
        "github": "https://github.com/vigojug/",
        "meetup": "https://www.meetup.com/es-ES/Vigo-JUG/",
        "twitter": "https://twitter.com/vigojug/",
        "linkedin": "https://www.linkedin.com/organization/11056204",
        "youtube": "https://www.youtube.com/channel/UCNOihTnorv6dZDANaPXgx_g"
      }
    },
    "wppontevedra": {
      "name": "WordpressPontevedra",
      "logo": "http://vigotech.org/images/wordpress-pontevedra.png",
      "links": {
        "meetup": "https://www.meetup.com/es-ES/Pontevedra-WordPress-Meetup/",
        "twitter": "https://twitter.com/wppontevedra"
      }
    },
    "vigowordpress": {
      "name": "VigoWordpress",
      "logo": "http://vigotech.org/images/vigowordpress.png",
      "links": {
        "mail": "wpmeetupvigo@gmail.com",
        "meetup": "https://www.meetup.com/es-ES/Vigo-WordPress-Meetup/",
        "twitter": "https://twitter.com/wp_vigo",
        "youtube": "https://www.youtube.com/channel/UCuipENHgKAhr1VgK59156Tw"
      }
    }
  }
}